"DESCRIPTION","DURATION IN MS","NAME","PARENT SUITE","START TIME","STATUS","STOP TIME","SUB SUITE","SUITE","TEST CLASS","TEST METHOD"
"","1163","Whitespaces is allowed in description and company name field","ux-tests.tests","Tue May 26 09:56:55 UTC 2026","passed","Tue May 26 09:56:56 UTC 2026","","test_RTP_submission","",""
"","1919","RTP form is filled and submitted","ux-tests.tests","Tue May 26 09:56:53 UTC 2026","passed","Tue May 26 09:56:54 UTC 2026","","test_RTP_submission","",""
"","3287","RTP form cancellation with reason PAID","ux-tests.tests","Tue May 26 09:56:49 UTC 2026","passed","Tue May 26 09:56:53 UTC 2026","","test_RTP_cancel","",""
"","4398","RTP form is filled and submitted","ux-tests.tests","Tue May 26 09:56:41 UTC 2026","passed","Tue May 26 09:56:45 UTC 2026","","test_RTP_cancel","",""
"","3714","RTP form cancellation with reason MODT","ux-tests.tests","Tue May 26 09:56:45 UTC 2026","passed","Tue May 26 09:56:49 UTC 2026","","test_RTP_cancel","",""
