"DESCRIPTION","DURATION IN MS","NAME","PARENT SUITE","START TIME","STATUS","STOP TIME","SUB SUITE","SUITE","TEST CLASS","TEST METHOD"
"Parametrized contract test generated from the Activation API OpenAPI spec.

Schemathesis derives one test case per endpoint defined in the spec, generating
request data (path params, query params, body) that is valid according to the schema.
Each case is executed against the live API and the response is validated with
CONTRACT_CHECKS.
","84601","test_activation_contract[GET /activations/payer]","contract-tests.tests","Thu Jul 16 09:26:10 UTC 2026","passed","Thu Jul 16 09:27:35 UTC 2026","","test_activation","",""
"Parametrized contract test generated from the Send API OpenAPI spec.

Schemathesis derives one test case per endpoint defined in the spec, generating
request data (path params, query params, body) that is valid according to the schema.
Each case is executed against the live API and the response is validated with
CONTRACT_CHECKS.

An additional assertion verifies that the Location header is present on 201 responses
from POST /rtps, as required by the spec.
","188442","test_send_api_contract[POST /gpd/message]","contract-tests.tests","Thu Jul 16 09:33:50 UTC 2026","passed","Thu Jul 16 09:36:58 UTC 2026","","test_api_send_rtp","",""
