"DESCRIPTION","DURATION IN MS","NAME","PARENT SUITE","START TIME","STATUS","STOP TIME","SUB SUITE","SUITE","TEST CLASS","TEST METHOD"
"","624","A Service Provider is authenticated","functional-tests.tests","Wed Nov 05 13:45:57 UTC 2025","broken","Wed Nov 05 13:45:58 UTC 2025","","test_auth","",""
"","498","An RTP is sent to Poste service with activated fiscal code","functional-tests.tests","Wed Nov 05 13:46:11 UTC 2025","broken","Wed Nov 05 13:46:11 UTC 2025","","test_send_rtp","",""
"","611","RTP cancellation fails if ID does not exist","functional-tests.tests","Wed Nov 05 13:46:02 UTC 2025","broken","Wed Nov 05 13:46:02 UTC 2025","","test_cancel_rtp","",""
"","0","Retrieving activation with invalid UUID returns 400","functional-tests.tests","Wed Nov 05 13:45:52 UTC 2025","broken","Wed Nov 05 13:45:52 UTC 2025","","test_activation","",""
"","1274","A debtor is deactivated by an authenticated service provider","functional-tests.tests","Wed Nov 05 13:46:02 UTC 2025","broken","Wed Nov 05 13:46:03 UTC 2025","","test_deactivation","",""
"","565","An authenticated Service Provider cannot send an RTP to an unactivated debtor","","Wed Nov 05 13:46:50 UTC 2025","broken","Wed Nov 05 13:46:50 UTC 2025","","","",""
"","1","An RTP is sent through ICCREA API","functional-tests.tests","Wed Nov 05 13:46:05 UTC 2025","broken","Wed Nov 05 13:46:05 UTC 2025","","test_debtor_service_provider_availability","",""
"","0","Find by payer id request must contain lower case fiscal code","functional-tests.tests","Wed Nov 05 13:45:50 UTC 2025","broken","Wed Nov 05 13:45:50 UTC 2025","","test_activation","",""
"","694","A Service Provider tries to activates a debtor without having the correct credentials","","Wed Nov 05 13:46:44 UTC 2025","passed","Wed Nov 05 13:46:45 UTC 2025","","","",""
"","0","Non-integer size returns 400","functional-tests.tests","Wed Nov 05 13:45:56 UTC 2025","broken","Wed Nov 05 13:45:56 UTC 2025","","test_activation","",""
"","516","RTP is successfully cancelled","functional-tests.tests","Wed Nov 05 13:46:01 UTC 2025","broken","Wed Nov 05 13:46:01 UTC 2025","","test_cancel_rtp","",""
"","485","An RTP is sent through API","functional-tests.tests","Wed Nov 05 13:46:10 UTC 2025","broken","Wed Nov 05 13:46:10 UTC 2025","","test_send_rtp","",""
"","609","malformed rtp_id → 400 Bad Request","functional-tests.tests","Wed Nov 05 13:46:06 UTC 2025","broken","Wed Nov 05 13:46:06 UTC 2025","","test_get_rtp","",""
"","484","Unauthorized request returns 401","functional-tests.tests","Wed Nov 05 13:45:55 UTC 2025","passed","Wed Nov 05 13:45:55 UTC 2025","","test_activation","",""
"","2","An RTP is sent through POSTE API","functional-tests.tests","Wed Nov 05 13:46:05 UTC 2025","broken","Wed Nov 05 13:46:05 UTC 2025","","test_debtor_service_provider_availability","",""
"","592","Debtor fiscal code must be lower case during RTP send","functional-tests.tests","Wed Nov 05 13:46:12 UTC 2025","broken","Wed Nov 05 13:46:12 UTC 2025","","test_send_rtp","",""
"","594","Successfully cancel a Request to Pay","","Wed Nov 05 13:46:47 UTC 2025","broken","Wed Nov 05 13:46:47 UTC 2025","","","",""
"","517","Deactivation fails for activation by another service provider","functional-tests.tests","Wed Nov 05 13:46:04 UTC 2025","broken","Wed Nov 05 13:46:04 UTC 2025","","test_deactivation","",""
"","1","Failed callback for non existing Service Provider - DS-08P compliant","functional-tests.tests","Wed Nov 05 13:46:01 UTC 2025","broken","Wed Nov 05 13:46:01 UTC 2025","","test_callback","",""
"","466","The response body contains a comprehensible error message","functional-tests.tests","Wed Nov 05 13:46:12 UTC 2025","broken","Wed Nov 05 13:46:13 UTC 2025","","test_send_rtp","",""
"","685","Attempt to cancel an already cancelled RTP","","Wed Nov 05 13:46:47 UTC 2025","broken","Wed Nov 05 13:46:48 UTC 2025","","","",""
"","568","Attempt to cancel a non-existing RTP","","Wed Nov 05 13:46:48 UTC 2025","broken","Wed Nov 05 13:46:49 UTC 2025","","","",""
"","0","Invalid NextActivationId format returns 400","functional-tests.tests","Wed Nov 05 13:45:55 UTC 2025","broken","Wed Nov 05 13:45:55 UTC 2025","","test_activation","",""
"","0","Get a page of activations","functional-tests.tests","Wed Nov 05 13:45:47 UTC 2025","broken","Wed Nov 05 13:45:47 UTC 2025","","test_activation","",""
"","470","A Service Provider with invalid client secret is not authenticated","functional-tests.tests","Wed Nov 05 13:45:59 UTC 2025","failed","Wed Nov 05 13:45:59 UTC 2025","","test_auth","",""
"","586","An authenticated creditor Service Provider can send an RTP to an activated debtor","","Wed Nov 05 13:46:49 UTC 2025","broken","Wed Nov 05 13:46:49 UTC 2025","","","",""
"","502","Deactivation fails for non-existing activation","functional-tests.tests","Wed Nov 05 13:46:03 UTC 2025","broken","Wed Nov 05 13:46:04 UTC 2025","","test_deactivation","",""
"","524","inexistent RTP -> empty body","functional-tests.tests","Wed Nov 05 13:46:05 UTC 2025","broken","Wed Nov 05 13:46:06 UTC 2025","","test_get_rtp","",""
"","0","Get payees with invalid authorization","functional-tests.tests","Wed Nov 05 13:46:14 UTC 2025","broken","Wed Nov 05 13:46:14 UTC 2025","TestServiceProvidersRegistry","test_service_providers_registry","",""
"","1","Failed callback for non existing Service Provider - DS-04b compliant","functional-tests.tests","Wed Nov 05 13:46:01 UTC 2025","broken","Wed Nov 05 13:46:01 UTC 2025","","test_callback","",""
"","0","Retrieving non-existent activation returns 404","functional-tests.tests","Wed Nov 05 13:45:51 UTC 2025","broken","Wed Nov 05 13:45:51 UTC 2025","","test_activation","",""
"","0","A debtor cannot be activated more than once","functional-tests.tests","Wed Nov 05 13:45:51 UTC 2025","broken","Wed Nov 05 13:45:51 UTC 2025","","test_activation","",""
"","0","A debtor service provider fails activation due to wrong service provider id","functional-tests.tests","Wed Nov 05 13:45:50 UTC 2025","broken","Wed Nov 05 13:45:50 UTC 2025","","test_activation","",""
"","1","Cannot send RTP with invalid amount","functional-tests.tests","Wed Nov 05 13:46:05 UTC 2025","broken","Wed Nov 05 13:46:05 UTC 2025","","test_debtor_service_provider_availability","",""
"","545","missing token → 401 Unauthorized","functional-tests.tests","Wed Nov 05 13:46:06 UTC 2025","passed","Wed Nov 05 13:46:07 UTC 2025","","test_get_rtp","",""
"","0","Non-existent NextActivationId returns 200 with empty body","functional-tests.tests","Wed Nov 05 13:45:57 UTC 2025","broken","Wed Nov 05 13:45:57 UTC 2025","","test_activation","",""
"","595","An authenticated Service Provider cannot send an RTP to an activated debtor","","Wed Nov 05 13:46:49 UTC 2025","broken","Wed Nov 05 13:46:50 UTC 2025","","","",""
"","598","Takeover fails with invalid OTP","","Wed Nov 05 13:46:46 UTC 2025","broken","Wed Nov 05 13:46:46 UTC 2025","","","",""
"","0","An RTP is sent through CBI API","functional-tests.tests","Wed Nov 05 13:46:04 UTC 2025","broken","Wed Nov 05 13:46:04 UTC 2025","","test_debtor_service_provider_availability","",""
"","724","A debtor Service Provider tries to activates a debtor 2 times, failing the second attempt","","Wed Nov 05 13:46:44 UTC 2025","broken","Wed Nov 05 13:46:44 UTC 2025","","","",""
"","1","Successful login","","Wed Nov 05 13:46:51 UTC 2025","passed","Wed Nov 05 13:46:51 UTC 2025","","","",""
"","624","An RTP callback is successfully received","functional-tests.tests","Wed Nov 05 13:46:00 UTC 2025","broken","Wed Nov 05 13:46:00 UTC 2025","","test_callback","",""
"","2","Cannot send RTP with an amount over the POSTE limit","functional-tests.tests","Wed Nov 05 13:46:05 UTC 2025","broken","Wed Nov 05 13:46:05 UTC 2025","","test_debtor_service_provider_availability","",""
"","1","Unauthorized callback due to wrong certificate serial","functional-tests.tests","Wed Nov 05 13:46:01 UTC 2025","broken","Wed Nov 05 13:46:01 UTC 2025","","test_callback","",""
"","1","Cannot send RTP with expired date","functional-tests.tests","Wed Nov 05 13:46:05 UTC 2025","broken","Wed Nov 05 13:46:05 UTC 2025","","test_debtor_service_provider_availability","",""
"","497","An RTP callback is successfully received","functional-tests.tests","Wed Nov 05 13:45:59 UTC 2025","broken","Wed Nov 05 13:46:00 UTC 2025","","test_callback","",""
"","0","Get payees with invalid authorization","functional-tests.tests","Wed Nov 05 13:46:09 UTC 2025","broken","Wed Nov 05 13:46:09 UTC 2025","TestPayeesRegistry","test_payees_registry","",""
"","487","An RTP is sent to ICCREA service with activated fiscal code","functional-tests.tests","Wed Nov 05 13:46:11 UTC 2025","broken","Wed Nov 05 13:46:12 UTC 2025","","test_send_rtp","",""
"","0","A debtor is activated by an authenticated service provider","functional-tests.tests","Wed Nov 05 13:45:47 UTC 2025","broken","Wed Nov 05 13:45:47 UTC 2025","","test_activation","",""
"","562","Takeover fails without authentication","","Wed Nov 05 13:46:46 UTC 2025","broken","Wed Nov 05 13:46:47 UTC 2025","","","",""
"","1","Auth endpoint returns valid token","functional-tests.tests","Wed Nov 05 13:46:04 UTC 2025","broken","Wed Nov 05 13:46:04 UTC 2025","","test_debtor_service_provider_availability","",""
"","501","The service returns the mocked server error","functional-tests.tests","Wed Nov 05 13:46:07 UTC 2025","passed","Wed Nov 05 13:46:08 UTC 2025","","test_mock","",""
"","613","Retrieving activation without valid token returns 401","functional-tests.tests","Wed Nov 05 13:45:53 UTC 2025","passed","Wed Nov 05 13:45:53 UTC 2025","","test_activation","",""
"","0","Cannot send RTP with expired date","functional-tests.tests","Wed Nov 05 13:46:05 UTC 2025","broken","Wed Nov 05 13:46:05 UTC 2025","","test_debtor_service_provider_availability","",""
"","674","A debtor Service Provider activates a debtor","","Wed Nov 05 13:46:43 UTC 2025","broken","Wed Nov 05 13:46:44 UTC 2025","","","",""
"","563","A debtor Service Provider successfully takes over an activation from another provider","","Wed Nov 05 13:46:45 UTC 2025","broken","Wed Nov 05 13:46:46 UTC 2025","","","",""
"Test the takeover flow where a user changes service provider","525","test_takeover_flow","functional-tests.tests","Wed Nov 05 13:46:14 UTC 2025","broken","Wed Nov 05 13:46:15 UTC 2025","","test_takeover","",""
"","646","The service returns the mocked server error","functional-tests.tests","Wed Nov 05 13:46:08 UTC 2025","passed","Wed Nov 05 13:46:09 UTC 2025","","test_mock","",""
"","0","The activation request must contain lower case fiscal code","functional-tests.tests","Wed Nov 05 13:45:49 UTC 2025","broken","Wed Nov 05 13:45:49 UTC 2025","","test_activation","",""
"","603","A debtor Service Provider cannot send an RTP","","Wed Nov 05 13:46:50 UTC 2025","broken","Wed Nov 05 13:46:51 UTC 2025","","","",""
"","502","An RTP callback with status ACTC is successfully received","functional-tests.tests","Wed Nov 05 13:46:00 UTC 2025","broken","Wed Nov 05 13:46:01 UTC 2025","","test_callback","",""
"","0","Invalid pagination parameters returns 400","functional-tests.tests","Wed Nov 05 13:45:53 UTC 2025","broken","Wed Nov 05 13:45:53 UTC 2025","","test_activation","",""
"Availability probe for takeover notification mock endpoint: expects 204 No Content","479","test_takeover_notification","functional-tests.tests","Wed Nov 05 13:46:15 UTC 2025","passed","Wed Nov 05 13:46:15 UTC 2025","","test_takeover","",""
"","0","Get paginated list of payees successfully","functional-tests.tests","Wed Nov 05 13:46:09 UTC 2025","broken","Wed Nov 05 13:46:09 UTC 2025","TestPayeesRegistry","test_payees_registry","",""
"","1","Unauthorized callback due to wrong certificate serial","functional-tests.tests","Wed Nov 05 13:46:01 UTC 2025","broken","Wed Nov 05 13:46:01 UTC 2025","","test_callback","",""
"","471","An RTP is sent through API","functional-tests.tests","Wed Nov 05 13:46:13 UTC 2025","broken","Wed Nov 05 13:46:13 UTC 2025","","test_send_rtp","",""
"","0","Missing Version header returns 200","functional-tests.tests","Wed Nov 05 13:45:56 UTC 2025","broken","Wed Nov 05 13:45:56 UTC 2025","","test_activation","",""
"","0","A debtor is activated and retrieved by activation id","functional-tests.tests","Wed Nov 05 13:45:48 UTC 2025","broken","Wed Nov 05 13:45:48 UTC 2025","","test_activation","",""
"","490","An RTP is sent to a CBI service with activated fiscal code","functional-tests.tests","Wed Nov 05 13:46:10 UTC 2025","broken","Wed Nov 05 13:46:11 UTC 2025","","test_send_rtp","",""
"","0","Get list of service providers successfully","functional-tests.tests","Wed Nov 05 13:46:13 UTC 2025","broken","Wed Nov 05 13:46:13 UTC 2025","TestServiceProvidersRegistry","test_service_providers_registry","",""
"","0","Invalid pagination parameters returns 400","functional-tests.tests","Wed Nov 05 13:45:54 UTC 2025","broken","Wed Nov 05 13:45:54 UTC 2025","","test_activation","",""
"","1","Cannot send RTP with invalid amount","functional-tests.tests","Wed Nov 05 13:46:04 UTC 2025","broken","Wed Nov 05 13:46:04 UTC 2025","","test_debtor_service_provider_availability","",""
"","515","RTP is successfully retrieved","functional-tests.tests","Wed Nov 05 13:46:05 UTC 2025","broken","Wed Nov 05 13:46:05 UTC 2025","","test_get_rtp","",""
"","549","The RTP web page is reachable","functional-tests.tests","Wed Nov 05 13:46:07 UTC 2025","passed","Wed Nov 05 13:46:07 UTC 2025","","test_landing_page","",""
"","610","A Service Provider with invalid client ID is not authenticated","functional-tests.tests","Wed Nov 05 13:45:58 UTC 2025","failed","Wed Nov 05 13:45:59 UTC 2025","","test_auth","",""
