"DESCRIPTION","DURATION IN MS","NAME","PARENT SUITE","START TIME","STATUS","STOP TIME","SUB SUITE","SUITE","TEST CLASS","TEST METHOD"
"","1114","A Service Provider is authenticated","tests","Tue Jan 21 07:06:30 GMT 2025","passed","Tue Jan 21 07:06:31 GMT 2025","","test_auth","",""
"","33912","Find by payer id request bust contain lower case fiscal code","tests","Tue Jan 21 07:05:56 GMT 2025","passed","Tue Jan 21 07:06:30 GMT 2025","","test_activation","",""
"","3590","Debtor fiscal code must be lower case during RTP send","tests","Tue Jan 21 07:06:33 GMT 2025","failed","Tue Jan 21 07:06:37 GMT 2025","","test_send_rtp","",""
"","802","A Service Provider with invalid client ID is not authenticated","tests","Tue Jan 21 07:06:31 GMT 2025","passed","Tue Jan 21 07:06:32 GMT 2025","","test_auth","",""
"","671","The RTP web page is reachable","tests","Tue Jan 21 07:06:33 GMT 2025","passed","Tue Jan 21 07:06:33 GMT 2025","","test_landing_page","",""
"","1052","A Service Provider with invalid client secret is not authenticated","tests","Tue Jan 21 07:06:32 GMT 2025","passed","Tue Jan 21 07:06:33 GMT 2025","","test_auth","",""
