"DESCRIPTION","DURATION IN MS","NAME","PARENT SUITE","START TIME","STATUS","STOP TIME","SUB SUITE","SUITE","TEST CLASS","TEST METHOD"
"","3466","A debtor Service Provider activates a debtor","","Tue Jan 14 16:41:27 GMT 2025","passed","Tue Jan 14 16:41:30 GMT 2025","","","",""
"","1","Successful login","","Tue Jan 14 16:41:49 GMT 2025","passed","Tue Jan 14 16:41:49 GMT 2025","","","",""
"","4474","An authenticated creditor Service Provider can send an RTP to an activated debtor","","Tue Jan 14 16:41:34 GMT 2025","passed","Tue Jan 14 16:41:39 GMT 2025","","","",""
"","3174","A debtor Service Provider cannot send an RTP","","Tue Jan 14 16:41:46 GMT 2025","passed","Tue Jan 14 16:41:49 GMT 2025","","","",""
"","781","A Service Provider tries to activates a debtor without having the correct credentials","","Tue Jan 14 16:41:34 GMT 2025","passed","Tue Jan 14 16:41:34 GMT 2025","","","",""
"","3246","A debtor Service Provider tries to activates a debtor 2 times, failing the second attempt","","Tue Jan 14 16:41:30 GMT 2025","passed","Tue Jan 14 16:41:34 GMT 2025","","","",""
"","4154","An authenticated Service Provider cannot send an RTP to an activated debtor","","Tue Jan 14 16:41:39 GMT 2025","passed","Tue Jan 14 16:41:43 GMT 2025","","","",""
"","2820","An authenticated Service Provider cannot send an RTP to an unactivated debtor","","Tue Jan 14 16:41:43 GMT 2025","passed","Tue Jan 14 16:41:46 GMT 2025","","","",""
