"DESCRIPTION","DURATION IN MS","NAME","PARENT SUITE","START TIME","STATUS","STOP TIME","SUB SUITE","SUITE","TEST CLASS","TEST METHOD"
"Parametrized contract test generated from the Send API OpenAPI spec.

Schemathesis derives one test case per endpoint defined in the spec, generating
request data (path params, query params, body) that is valid according to the schema.
Each case is executed against the live API and the response is validated with
CONTRACT_CHECKS.

An additional assertion verifies that the Location header is present on 201 responses
from POST /rtps, as required by the spec.
","136576","test_send_api_contract[POST /gpd/message]","contract-tests.tests","Tue Jul 21 07:26:00 UTC 2026","passed","Tue Jul 21 07:28:17 UTC 2026","","test_api_send_rtp","",""
"Parametrized contract test generated from the Activation API OpenAPI spec.

Schemathesis derives one test case per endpoint defined in the spec, generating
request data (path params, query params, body) that is valid according to the schema.
Each case is executed against the live API and the response is validated with
CONTRACT_CHECKS.
","56226","test_activation_contract[GET /activations/payer]","contract-tests.tests","Tue Jul 21 07:20:47 UTC 2026","passed","Tue Jul 21 07:21:43 UTC 2026","","test_activation","",""
