"DESCRIPTION","DURATION IN MS","NAME","PARENT SUITE","START TIME","STATUS","STOP TIME","SUB SUITE","SUITE","TEST CLASS","TEST METHOD"
"","3193","A debtor Service Provider activates a debtor","","Sat Mar 22 07:07:44 GMT 2025","passed","Sat Mar 22 07:07:47 GMT 2025","","","",""
"","1","Successful login","","Sat Mar 22 07:08:17 GMT 2025","passed","Sat Mar 22 07:08:17 GMT 2025","","","",""
"","2629","A debtor Service Provider cannot send an RTP","","Sat Mar 22 07:08:15 GMT 2025","passed","Sat Mar 22 07:08:17 GMT 2025","","","",""
"","18023","An authenticated creditor Service Provider can send an RTP to an activated debtor","","Sat Mar 22 07:07:51 GMT 2025","failed","Sat Mar 22 07:08:09 GMT 2025","","","",""
"","2705","A debtor Service Provider tries to activates a debtor 2 times, failing the second attempt","","Sat Mar 22 07:07:47 GMT 2025","passed","Sat Mar 22 07:07:50 GMT 2025","","","",""
"","3776","An authenticated Service Provider cannot send an RTP to an activated debtor","","Sat Mar 22 07:08:09 GMT 2025","passed","Sat Mar 22 07:08:12 GMT 2025","","","",""
"","755","A Service Provider tries to activates a debtor without having the correct credentials","","Sat Mar 22 07:07:50 GMT 2025","passed","Sat Mar 22 07:07:51 GMT 2025","","","",""
"","2241","An authenticated Service Provider cannot send an RTP to an unactivated debtor","","Sat Mar 22 07:08:12 GMT 2025","passed","Sat Mar 22 07:08:15 GMT 2025","","","",""
