"DESCRIPTION","DURATION IN MS","NAME","PARENT SUITE","START TIME","STATUS","STOP TIME","SUB SUITE","SUITE","TEST CLASS","TEST METHOD"
"","713","A Service Provider tries to activates a debtor without having the correct credentials","","Thu Feb 06 08:16:12 GMT 2025","passed","Thu Feb 06 08:16:13 GMT 2025","","","",""
"","3644","An authenticated Service Provider cannot send an RTP to an activated debtor","","Thu Feb 06 08:16:16 GMT 2025","passed","Thu Feb 06 08:16:20 GMT 2025","","","",""
"","2995","A debtor Service Provider activates a debtor","","Thu Feb 06 08:16:06 GMT 2025","passed","Thu Feb 06 08:16:09 GMT 2025","","","",""
"","2520","An authenticated Service Provider cannot send an RTP to an unactivated debtor","","Thu Feb 06 08:16:20 GMT 2025","passed","Thu Feb 06 08:16:22 GMT 2025","","","",""
"","1","Successful login","","Thu Feb 06 08:16:25 GMT 2025","passed","Thu Feb 06 08:16:25 GMT 2025","","","",""
"","2677","A debtor Service Provider cannot send an RTP","","Thu Feb 06 08:16:22 GMT 2025","passed","Thu Feb 06 08:16:25 GMT 2025","","","",""
"","3721","An authenticated creditor Service Provider can send an RTP to an activated debtor","","Thu Feb 06 08:16:13 GMT 2025","passed","Thu Feb 06 08:16:16 GMT 2025","","","",""
"","2716","A debtor Service Provider tries to activates a debtor 2 times, failing the second attempt","","Thu Feb 06 08:16:09 GMT 2025","passed","Thu Feb 06 08:16:12 GMT 2025","","","",""
