"DESCRIPTION","DURATION IN MS","NAME","PARENT SUITE","START TIME","STATUS","STOP TIME","SUB SUITE","SUITE","TEST CLASS","TEST METHOD"
"","715","A Service Provider with invalid client secret is not authenticated","tests","Tue Jan 21 08:39:04 GMT 2025","passed","Tue Jan 21 08:39:05 GMT 2025","","test_auth","",""
"","1265","Find by payer id request bust contain lower case fiscal code","tests","Tue Jan 21 08:39:01 GMT 2025","passed","Tue Jan 21 08:39:02 GMT 2025","","test_activation","",""
"","656","A Service Provider with invalid client ID is not authenticated","tests","Tue Jan 21 08:39:03 GMT 2025","passed","Tue Jan 21 08:39:04 GMT 2025","","test_auth","",""
"","2593","Debtor fiscal code must be lower case during RTP send","tests","Tue Jan 21 08:39:08 GMT 2025","passed","Tue Jan 21 08:39:10 GMT 2025","","test_send_rtp","",""
"","2072","A debtor is activated by an authenticated service provider","tests","Tue Jan 21 08:38:58 GMT 2025","passed","Tue Jan 21 08:39:00 GMT 2025","","test_activation","",""
"","68","The RTP web page is reachable","tests","Tue Jan 21 08:39:05 GMT 2025","passed","Tue Jan 21 08:39:05 GMT 2025","","test_landing_page","",""
"","1199","A Service Provider is authenticated","tests","Tue Jan 21 08:39:02 GMT 2025","passed","Tue Jan 21 08:39:03 GMT 2025","","test_auth","",""
"","1389","The activation request bust contain lower case fiscal code","tests","Tue Jan 21 08:39:00 GMT 2025","passed","Tue Jan 21 08:39:01 GMT 2025","","test_activation","",""
"","2752","An RTP is sent through API","tests","Tue Jan 21 08:39:05 GMT 2025","passed","Tue Jan 21 08:39:08 GMT 2025","","test_send_rtp","",""
