"DESCRIPTION","DURATION IN MS","NAME","PARENT SUITE","START TIME","STATUS","STOP TIME","SUB SUITE","SUITE","TEST CLASS","TEST METHOD"
"","2304","An authenticated Service Provider cannot send an RTP to an unactivated debtor","","Sat Mar 29 07:08:17 GMT 2025","passed","Sat Mar 29 07:08:20 GMT 2025","","","",""
"","3657","An authenticated creditor Service Provider can send an RTP to an activated debtor","","Sat Mar 29 07:08:09 GMT 2025","passed","Sat Mar 29 07:08:13 GMT 2025","","","",""
"","3425","A debtor Service Provider tries to activates a debtor 2 times, failing the second attempt","","Sat Mar 29 07:08:05 GMT 2025","passed","Sat Mar 29 07:08:09 GMT 2025","","","",""
"","2921","A debtor Service Provider cannot send an RTP","","Sat Mar 29 07:08:20 GMT 2025","passed","Sat Mar 29 07:08:23 GMT 2025","","","",""
"","3231","A debtor Service Provider activates a debtor","","Sat Mar 29 07:08:02 GMT 2025","passed","Sat Mar 29 07:08:05 GMT 2025","","","",""
"","4447","An authenticated Service Provider cannot send an RTP to an activated debtor","","Sat Mar 29 07:08:13 GMT 2025","passed","Sat Mar 29 07:08:17 GMT 2025","","","",""
"","1","Successful login","","Sat Mar 29 07:08:23 GMT 2025","passed","Sat Mar 29 07:08:23 GMT 2025","","","",""
"","617","A Service Provider tries to activates a debtor without having the correct credentials","","Sat Mar 29 07:08:09 GMT 2025","passed","Sat Mar 29 07:08:09 GMT 2025","","","",""
