"DESCRIPTION","DURATION IN MS","NAME","PARENT SUITE","START TIME","STATUS","STOP TIME","SUB SUITE","SUITE","TEST CLASS","TEST METHOD"
"","2453","A debtor Service Provider cannot send an RTP","","Thu Feb 20 08:19:16 GMT 2025","passed","Thu Feb 20 08:19:18 GMT 2025","","","",""
"","3785","An authenticated Service Provider cannot send an RTP to an activated debtor","","Thu Feb 20 08:19:09 GMT 2025","passed","Thu Feb 20 08:19:13 GMT 2025","","","",""
"","3570","An authenticated creditor Service Provider can send an RTP to an activated debtor","","Thu Feb 20 08:19:05 GMT 2025","passed","Thu Feb 20 08:19:09 GMT 2025","","","",""
"","2617","A debtor Service Provider activates a debtor","","Thu Feb 20 08:19:00 GMT 2025","passed","Thu Feb 20 08:19:03 GMT 2025","","","",""
"","363","A Service Provider tries to activates a debtor without having the correct credentials","","Thu Feb 20 08:19:05 GMT 2025","passed","Thu Feb 20 08:19:05 GMT 2025","","","",""
"","2873","An authenticated Service Provider cannot send an RTP to an unactivated debtor","","Thu Feb 20 08:19:13 GMT 2025","passed","Thu Feb 20 08:19:16 GMT 2025","","","",""
"","1","Successful login","","Thu Feb 20 08:19:18 GMT 2025","passed","Thu Feb 20 08:19:18 GMT 2025","","","",""
"","2293","A debtor Service Provider tries to activates a debtor 2 times, failing the second attempt","","Thu Feb 20 08:19:03 GMT 2025","passed","Thu Feb 20 08:19:05 GMT 2025","","","",""
