"DESCRIPTION","DURATION IN MS","NAME","PARENT SUITE","START TIME","STATUS","STOP TIME","SUB SUITE","SUITE","TEST CLASS","TEST METHOD"
"","552","A Service Provider with invalid client ID is not authenticated","functional-tests.tests","Wed Dec 10 10:34:18 UTC 2025","passed","Wed Dec 10 10:34:19 UTC 2025","","test_auth","",""
"","930","Debtor fiscal code must be lower case during RTP send","functional-tests.tests","Wed Dec 10 10:34:09 UTC 2025","passed","Wed Dec 10 10:34:10 UTC 2025","","test_RTP_send_MOCK","",""
"Test that takeover fails when the service provider is unauthenticated","1394","Test Takeover Fails with Unauthenticated SP","functional-tests.tests","Wed Dec 10 10:35:20 UTC 2025","passed","Wed Dec 10 10:35:21 UTC 2025","","test_debtor_takeover","",""
"","2124","An RTP callback is successfully received","functional-tests.tests","Wed Dec 10 10:33:44 UTC 2025","passed","Wed Dec 10 10:33:46 UTC 2025","","test_RTP_callback","",""
"","954","A debtor is deactivated by an authenticated service provider","functional-tests.tests","Wed Dec 10 10:35:08 UTC 2025","passed","Wed Dec 10 10:35:09 UTC 2025","","test_debtor_deactivation","",""
"","1563","RTP is successfully retrieved","functional-tests.tests","Wed Dec 10 10:33:56 UTC 2025","passed","Wed Dec 10 10:33:58 UTC 2025","","test_RTP_get","",""
"
Verify that a debt position can be deleted successfully.
","2409","Happy path: a debt position is deleted in UAT environment","functional-tests.tests","Wed Dec 10 10:34:28 UTC 2025","passed","Wed Dec 10 10:34:31 UTC 2025","","test_availability_GPD","",""
"","929","Get a page of activations","functional-tests.tests","Wed Dec 10 10:34:59 UTC 2025","passed","Wed Dec 10 10:35:00 UTC 2025","","test_debtor_activation_list","",""
"","429","All auth fixtures expose a valid Bearer token format","functional-tests.tests","Wed Dec 10 10:34:17 UTC 2025","passed","Wed Dec 10 10:34:17 UTC 2025","","test_auth","",""
"","438","All auth fixtures expose a valid Bearer token format","functional-tests.tests","Wed Dec 10 10:34:16 UTC 2025","passed","Wed Dec 10 10:34:17 UTC 2025","","test_auth","",""
"","2292","An RTP is sent to ICCREA service with activated fiscal code","functional-tests.tests","Wed Dec 10 10:34:04 UTC 2025","failed","Wed Dec 10 10:34:06 UTC 2025","","test_RTP_send_ICCREA","",""
"","452","Failed callback for non existing Service Provider - DS-04b compliant","functional-tests.tests","Wed Dec 10 10:33:50 UTC 2025","passed","Wed Dec 10 10:33:51 UTC 2025","","test_RTP_callback","",""
"","423","Get payees with invalid authorization","functional-tests.tests","Wed Dec 10 10:35:35 UTC 2025","passed","Wed Dec 10 10:35:36 UTC 2025","","test_service_registry_payees_registry","",""
"
Verify that a debt position can be created and published successfully.
","486","Happy path: a debt position is created and published in DEV environment","functional-tests.tests","Wed Dec 10 10:34:28 UTC 2025","passed","Wed Dec 10 10:34:28 UTC 2025","","test_availability_GPD","",""
"","481","Deactivation fails for non-existing activation","functional-tests.tests","Wed Dec 10 10:35:10 UTC 2025","passed","Wed Dec 10 10:35:10 UTC 2025","","test_debtor_deactivation","",""
"Test the takeover flow where a user changes service provider","3371","Test Takeover Flow","functional-tests.tests","Wed Dec 10 10:35:13 UTC 2025","passed","Wed Dec 10 10:35:16 UTC 2025","","test_debtor_takeover","",""
"","2646","An RTP callback is successfully received","functional-tests.tests","Wed Dec 10 10:33:40 UTC 2025","passed","Wed Dec 10 10:33:42 UTC 2025","","test_RTP_callback","",""
"","451","Find by payer id request must contain lower case fiscal code","functional-tests.tests","Wed Dec 10 10:34:54 UTC 2025","passed","Wed Dec 10 10:34:55 UTC 2025","","test_debtor_activation_create","",""
"Takeover without a previously issued OTP should fail","923","Test Takeover Fails without Prior OTP","functional-tests.tests","Wed Dec 10 10:35:24 UTC 2025","passed","Wed Dec 10 10:35:25 UTC 2025","","test_debtor_takeover","",""
"Takeover with syntactically valid but nonsensical body should fail","1403","Test Takeover Fails with Nonsensical Body","functional-tests.tests","Wed Dec 10 10:35:33 UTC 2025","passed","Wed Dec 10 10:35:34 UTC 2025","","test_debtor_takeover","",""
"","996","Auth endpoint returns valid token","functional-tests.tests","Wed Dec 10 10:34:20 UTC 2025","passed","Wed Dec 10 10:34:21 UTC 2025","","test_availability_CBI","",""
"","0","A Service Provider is authenticated","functional-tests.tests","Wed Dec 10 10:34:16 UTC 2025","passed","Wed Dec 10 10:34:16 UTC 2025","","test_auth","",""
"","423","All auth fixtures expose a valid Bearer token format","functional-tests.tests","Wed Dec 10 10:34:17 UTC 2025","passed","Wed Dec 10 10:34:17 UTC 2025","","test_auth","",""
"
Verify that a debt position can be updated successfully.
","6443","Happy path: a debt position is updated in UAT environment","functional-tests.tests","Wed Dec 10 10:34:33 UTC 2025","passed","Wed Dec 10 10:34:40 UTC 2025","","test_availability_GPD","",""
"","851","Cannot send RTP with invalid amount","functional-tests.tests","Wed Dec 10 10:34:49 UTC 2025","passed","Wed Dec 10 10:34:50 UTC 2025","","test_availability_POSTE","",""
"","3406","An RTP is sent through CBI API","functional-tests.tests","Wed Dec 10 10:34:21 UTC 2025","passed","Wed Dec 10 10:34:24 UTC 2025","","test_availability_CBI","",""
"","451","inexistent RTP -> empty body","functional-tests.tests","Wed Dec 10 10:33:58 UTC 2025","passed","Wed Dec 10 10:33:59 UTC 2025","","test_RTP_get","",""
"","942","The response body contains a comprehensible error message","functional-tests.tests","Wed Dec 10 10:34:11 UTC 2025","passed","Wed Dec 10 10:34:12 UTC 2025","","test_RTP_send_MOCK","",""
"","409","All auth fixtures expose a valid Bearer token format","functional-tests.tests","Wed Dec 10 10:34:16 UTC 2025","passed","Wed Dec 10 10:34:16 UTC 2025","","test_auth","",""
"","462","Retrieving activation with invalid UUID returns 400","functional-tests.tests","Wed Dec 10 10:34:58 UTC 2025","passed","Wed Dec 10 10:34:58 UTC 2025","","test_debtor_activation_get","",""
"","484","Get paginated list of payees successfully","functional-tests.tests","Wed Dec 10 10:35:35 UTC 2025","passed","Wed Dec 10 10:35:35 UTC 2025","","test_service_registry_payees_registry","",""
"","830","Cannot send RTP with expired date","functional-tests.tests","Wed Dec 10 10:34:51 UTC 2025","passed","Wed Dec 10 10:34:52 UTC 2025","","test_availability_POSTE","",""
"","2901","An RTP is sent to a CBI service with activated fiscal code","functional-tests.tests","Wed Dec 10 10:34:01 UTC 2025","failed","Wed Dec 10 10:34:03 UTC 2025","","test_RTP_send_CBI","",""
"","465","Invalid pagination parameters returns 400","functional-tests.tests","Wed Dec 10 10:35:03 UTC 2025","passed","Wed Dec 10 10:35:04 UTC 2025","","test_debtor_activation_list","",""
"Availability probe for takeover notification mock endpoint: expects 204 No Content","428","Test Takeover Notification Endpoint","functional-tests.tests","Wed Dec 10 10:35:16 UTC 2025","passed","Wed Dec 10 10:35:17 UTC 2025","","test_debtor_takeover","",""
"Authenticated but not authorized: token of SP A tries to use OTP issued for SP B","1425","Test Takeover Fails with Wrong SP Token","functional-tests.tests","Wed Dec 10 10:35:28 UTC 2025","passed","Wed Dec 10 10:35:29 UTC 2025","","test_debtor_takeover","",""
"
Verify that a debt position can be updated successfully.
","6385","Happy path: a debt position is updated in DEV environment","functional-tests.tests","Wed Dec 10 10:34:40 UTC 2025","passed","Wed Dec 10 10:34:46 UTC 2025","","test_availability_GPD","",""
"","444","missing token → 401 Unauthorized","functional-tests.tests","Wed Dec 10 10:34:00 UTC 2025","passed","Wed Dec 10 10:34:00 UTC 2025","","test_RTP_get","",""
"","467","Invalid NextActivationId format returns 400","functional-tests.tests","Wed Dec 10 10:35:05 UTC 2025","passed","Wed Dec 10 10:35:05 UTC 2025","","test_debtor_activation_list","",""
"
Verify that a debt position can be deleted successfully.
","2399","Happy path: a debt position is deleted in DEV environment","functional-tests.tests","Wed Dec 10 10:34:31 UTC 2025","passed","Wed Dec 10 10:34:33 UTC 2025","","test_availability_GPD","",""
"","546","Get list of service providers successfully","functional-tests.tests","Wed Dec 10 10:35:36 UTC 2025","passed","Wed Dec 10 10:35:37 UTC 2025","","test_service_registry_service_providers","",""
"","673","A Service Provider with invalid client secret is not authenticated","functional-tests.tests","Wed Dec 10 10:34:19 UTC 2025","passed","Wed Dec 10 10:34:20 UTC 2025","","test_auth","",""
"","438","Non-existent NextActivationId returns 200 with empty body","functional-tests.tests","Wed Dec 10 10:35:07 UTC 2025","passed","Wed Dec 10 10:35:08 UTC 2025","","test_debtor_activation_list","",""
"","477","Retrieving non-existent activation returns 404","functional-tests.tests","Wed Dec 10 10:34:57 UTC 2025","passed","Wed Dec 10 10:34:58 UTC 2025","","test_debtor_activation_get","",""
"","490","An RTP is sent through API","functional-tests.tests","Wed Dec 10 10:34:12 UTC 2025","passed","Wed Dec 10 10:34:13 UTC 2025","","test_RTP_send_MOCK","",""
"","445","A debtor service provider fails activation due to wrong service provider id","functional-tests.tests","Wed Dec 10 10:35:00 UTC 2025","passed","Wed Dec 10 10:35:01 UTC 2025","","test_debtor_activation_list","",""
"","463","Non-integer size returns 400","functional-tests.tests","Wed Dec 10 10:35:06 UTC 2025","passed","Wed Dec 10 10:35:06 UTC 2025","","test_debtor_activation_list","",""
"","437","Unauthorized callback due to wrong certificate serial","functional-tests.tests","Wed Dec 10 10:33:50 UTC 2025","passed","Wed Dec 10 10:33:50 UTC 2025","","test_RTP_callback","",""
"","1565","RTP is successfully cancelled","functional-tests.tests","Wed Dec 10 10:33:52 UTC 2025","passed","Wed Dec 10 10:33:54 UTC 2025","","test_RTP_cancel","",""
"","978","A debtor cannot be activated more than once","functional-tests.tests","Wed Dec 10 10:35:01 UTC 2025","passed","Wed Dec 10 10:35:02 UTC 2025","","test_debtor_activation_list","",""
"","463","malformed rtp_id → 400 Bad Request","functional-tests.tests","Wed Dec 10 10:33:59 UTC 2025","passed","Wed Dec 10 10:34:00 UTC 2025","","test_RTP_get","",""
"","452","Failed callback for non existing Service Provider - DS-08P compliant","functional-tests.tests","Wed Dec 10 10:33:51 UTC 2025","passed","Wed Dec 10 10:33:51 UTC 2025","","test_RTP_callback","",""
"","871","An RTP is sent through POSTE API","functional-tests.tests","Wed Dec 10 10:34:48 UTC 2025","failed","Wed Dec 10 10:34:49 UTC 2025","","test_availability_POSTE","",""
"","1321","An RTP is sent through ICCREA API","functional-tests.tests","Wed Dec 10 10:34:46 UTC 2025","failed","Wed Dec 10 10:34:47 UTC 2025","","test_availability_ICCREA","",""
"Test that takeover fails when an invalid OTP is provided","1413","Test Takeover Fails with Invalid OTP","functional-tests.tests","Wed Dec 10 10:35:18 UTC 2025","passed","Wed Dec 10 10:35:19 UTC 2025","","test_debtor_takeover","",""
"Empty OTP should be rejected","553","Test Takeover Fails with Empty OTP","functional-tests.tests","Wed Dec 10 10:35:26 UTC 2025","passed","Wed Dec 10 10:35:27 UTC 2025","","test_debtor_takeover","",""
"","452","Retrieving activation without valid token returns 401","functional-tests.tests","Wed Dec 10 10:34:56 UTC 2025","passed","Wed Dec 10 10:34:57 UTC 2025","","test_debtor_activation_get","",""
"","1612","Cannot send RTP with invalid amount","functional-tests.tests","Wed Dec 10 10:34:24 UTC 2025","passed","Wed Dec 10 10:34:26 UTC 2025","","test_availability_CBI","",""
"","1761","Cannot send RTP with expired date","functional-tests.tests","Wed Dec 10 10:34:26 UTC 2025","passed","Wed Dec 10 10:34:28 UTC 2025","","test_availability_CBI","",""
"","937","A debtor is activated and retrieved by activation id","functional-tests.tests","Wed Dec 10 10:34:55 UTC 2025","passed","Wed Dec 10 10:34:56 UTC 2025","","test_debtor_activation_get","",""
"
Verify that a debt position can be created and published successfully.
","478","Happy path: a debt position is created and published in UAT environment","functional-tests.tests","Wed Dec 10 10:34:28 UTC 2025","passed","Wed Dec 10 10:34:28 UTC 2025","","test_availability_GPD","",""
"","2138","An RTP callback with status ACTC is successfully received","functional-tests.tests","Wed Dec 10 10:33:47 UTC 2025","passed","Wed Dec 10 10:33:49 UTC 2025","","test_RTP_callback","",""
"","801","Cannot send RTP with an amount over the POSTE limit","functional-tests.tests","Wed Dec 10 10:34:50 UTC 2025","passed","Wed Dec 10 10:34:51 UTC 2025","","test_availability_POSTE","",""
"","419","The service returns the mocked server error","functional-tests.tests","Wed Dec 10 10:34:48 UTC 2025","passed","Wed Dec 10 10:34:48 UTC 2025","","test_availability_MOCK","",""
"","612","RTP cancellation fails if ID does not exist","functional-tests.tests","Wed Dec 10 10:33:54 UTC 2025","passed","Wed Dec 10 10:33:55 UTC 2025","","test_RTP_cancel","",""
"","458","Unauthorized callback due to wrong certificate serial","functional-tests.tests","Wed Dec 10 10:33:49 UTC 2025","passed","Wed Dec 10 10:33:50 UTC 2025","","test_RTP_callback","",""
"","988","An RTP is sent through API","functional-tests.tests","Wed Dec 10 10:34:07 UTC 2025","passed","Wed Dec 10 10:34:08 UTC 2025","","test_RTP_send_MOCK","",""
"","430","All auth fixtures expose a valid Bearer token format","functional-tests.tests","Wed Dec 10 10:34:17 UTC 2025","passed","Wed Dec 10 10:34:18 UTC 2025","","test_auth","",""
"","58","The RTP web page is reachable","functional-tests.tests","Wed Dec 10 10:34:52 UTC 2025","passed","Wed Dec 10 10:34:52 UTC 2025","","test_availability_RTP_webform","",""
"","451","Unauthorized request returns 401","functional-tests.tests","Wed Dec 10 10:35:04 UTC 2025","passed","Wed Dec 10 10:35:04 UTC 2025","","test_debtor_activation_list","",""
"","419","Missing Version header returns 200","functional-tests.tests","Wed Dec 10 10:35:07 UTC 2025","passed","Wed Dec 10 10:35:07 UTC 2025","","test_debtor_activation_list","",""
"","433","The service returns the mocked server error","functional-tests.tests","Wed Dec 10 10:34:47 UTC 2025","passed","Wed Dec 10 10:34:48 UTC 2025","","test_availability_MOCK","",""
"","443","Get payees with invalid authorization","functional-tests.tests","Wed Dec 10 10:35:37 UTC 2025","passed","Wed Dec 10 10:35:37 UTC 2025","","test_service_registry_service_providers","",""
"","935","A debtor is activated by an authenticated service provider","functional-tests.tests","Wed Dec 10 10:34:52 UTC 2025","passed","Wed Dec 10 10:34:53 UTC 2025","","test_debtor_activation_create","",""
"","438","All auth fixtures expose a valid Bearer token format","functional-tests.tests","Wed Dec 10 10:34:18 UTC 2025","passed","Wed Dec 10 10:34:18 UTC 2025","","test_auth","",""
"","951","Deactivation fails for activation by another service provider","functional-tests.tests","Wed Dec 10 10:35:11 UTC 2025","passed","Wed Dec 10 10:35:12 UTC 2025","","test_debtor_deactivation","",""
"","469","The activation request must contain lower case fiscal code","functional-tests.tests","Wed Dec 10 10:34:54 UTC 2025","passed","Wed Dec 10 10:34:54 UTC 2025","","test_debtor_activation_create","",""
"OTP bound to payer1 should not work for payer2","1354","Test Takeover Fails with OTP Bound to Different Payer","functional-tests.tests","Wed Dec 10 10:35:22 UTC 2025","passed","Wed Dec 10 10:35:24 UTC 2025","","test_debtor_takeover","",""
"","483","Invalid pagination parameters returns 400","functional-tests.tests","Wed Dec 10 10:35:03 UTC 2025","passed","Wed Dec 10 10:35:03 UTC 2025","","test_debtor_activation_list","",""
"","2229","An RTP is sent to Poste service with activated fiscal code","functional-tests.tests","Wed Dec 10 10:34:13 UTC 2025","failed","Wed Dec 10 10:34:15 UTC 2025","","test_RTP_send_POSTE","",""
"Reusing the same OTP after a successful takeover should fail","1888","Test Takeover Fails with Reused OTP","functional-tests.tests","Wed Dec 10 10:35:30 UTC 2025","passed","Wed Dec 10 10:35:32 UTC 2025","","test_debtor_takeover","",""
