"DESCRIPTION","DURATION IN MS","NAME","PARENT SUITE","START TIME","STATUS","STOP TIME","SUB SUITE","SUITE","TEST CLASS","TEST METHOD"
"","3091","RTP form cancellation with reason MODT","ux-tests.tests","Mon Jun 08 10:45:33 UTC 2026","passed","Mon Jun 08 10:45:36 UTC 2026","","test_RTP_cancel","",""
"","5443","RTP form is filled and submitted","ux-tests.tests","Mon Jun 08 10:45:27 UTC 2026","passed","Mon Jun 08 10:45:33 UTC 2026","","test_RTP_cancel","",""
"","2881","RTP form cancellation with reason PAID","ux-tests.tests","Mon Jun 08 10:45:36 UTC 2026","passed","Mon Jun 08 10:45:39 UTC 2026","","test_RTP_cancel","",""
"","1154","Whitespaces is allowed in description and company name field","ux-tests.tests","Mon Jun 08 10:45:41 UTC 2026","passed","Mon Jun 08 10:45:42 UTC 2026","","test_RTP_submission","",""
"","2198","RTP form is filled and submitted","ux-tests.tests","Mon Jun 08 10:45:39 UTC 2026","passed","Mon Jun 08 10:45:41 UTC 2026","","test_RTP_submission","",""
