"DESCRIPTION","DURATION IN MS","NAME","PARENT SUITE","START TIME","STATUS","STOP TIME","SUB SUITE","SUITE","TEST CLASS","TEST METHOD"
"","4127","An authenticated creditor Service Provider can send an RTP to an activated debtor","","Sat Feb 22 07:06:46 GMT 2025","passed","Sat Feb 22 07:06:50 GMT 2025","","","",""
"","2771","A debtor Service Provider tries to activates a debtor 2 times, failing the second attempt","","Sat Feb 22 07:06:43 GMT 2025","passed","Sat Feb 22 07:06:46 GMT 2025","","","",""
"","528","A Service Provider tries to activates a debtor without having the correct credentials","","Sat Feb 22 07:06:46 GMT 2025","passed","Sat Feb 22 07:06:46 GMT 2025","","","",""
"","2405","A debtor Service Provider cannot send an RTP","","Sat Feb 22 07:06:58 GMT 2025","passed","Sat Feb 22 07:07:00 GMT 2025","","","",""
"","2783","An authenticated Service Provider cannot send an RTP to an unactivated debtor","","Sat Feb 22 07:06:55 GMT 2025","passed","Sat Feb 22 07:06:58 GMT 2025","","","",""
"","2586","A debtor Service Provider activates a debtor","","Sat Feb 22 07:06:40 GMT 2025","passed","Sat Feb 22 07:06:43 GMT 2025","","","",""
"","1","Successful login","","Sat Feb 22 07:07:00 GMT 2025","passed","Sat Feb 22 07:07:00 GMT 2025","","","",""
"","4686","An authenticated Service Provider cannot send an RTP to an activated debtor","","Sat Feb 22 07:06:50 GMT 2025","passed","Sat Feb 22 07:06:55 GMT 2025","","","",""
