"DESCRIPTION","DURATION IN MS","NAME","PARENT SUITE","START TIME","STATUS","STOP TIME","SUB SUITE","SUITE","TEST CLASS","TEST METHOD"
"","2154","An authenticated Service Provider cannot send an RTP to an activated debtor","","Thu Apr 03 07:08:32 GMT 2025","passed","Thu Apr 03 07:08:34 GMT 2025","","","",""
"","1191","An authenticated Service Provider cannot send an RTP to an unactivated debtor","","Thu Apr 03 07:08:34 GMT 2025","passed","Thu Apr 03 07:08:35 GMT 2025","","","",""
"","1","Successful login","","Thu Apr 03 07:08:37 GMT 2025","passed","Thu Apr 03 07:08:37 GMT 2025","","","",""
"","2387","An authenticated creditor Service Provider can send an RTP to an activated debtor","","Thu Apr 03 07:08:29 GMT 2025","passed","Thu Apr 03 07:08:32 GMT 2025","","","",""
"","1788","A debtor Service Provider tries to activates a debtor 2 times, failing the second attempt","","Thu Apr 03 07:08:27 GMT 2025","passed","Thu Apr 03 07:08:29 GMT 2025","","","",""
"","393","A Service Provider tries to activates a debtor without having the correct credentials","","Thu Apr 03 07:08:29 GMT 2025","passed","Thu Apr 03 07:08:29 GMT 2025","","","",""
"","5973","A debtor Service Provider activates a debtor","","Thu Apr 03 07:08:21 GMT 2025","passed","Thu Apr 03 07:08:27 GMT 2025","","","",""
"","1639","A debtor Service Provider cannot send an RTP","","Thu Apr 03 07:08:35 GMT 2025","passed","Thu Apr 03 07:08:37 GMT 2025","","","",""
