"DESCRIPTION","DURATION IN MS","NAME","PARENT SUITE","START TIME","STATUS","STOP TIME","SUB SUITE","SUITE","TEST CLASS","TEST METHOD"
"","2282","An authenticated Service Provider cannot send an RTP to an unactivated debtor","","Wed Feb 12 07:07:21 GMT 2025","passed","Wed Feb 12 07:07:23 GMT 2025","","","",""
"","1","Successful login","","Wed Feb 12 07:07:25 GMT 2025","passed","Wed Feb 12 07:07:25 GMT 2025","","","",""
"","1948","A debtor Service Provider cannot send an RTP","","Wed Feb 12 07:07:23 GMT 2025","passed","Wed Feb 12 07:07:25 GMT 2025","","","",""
"","2284","A debtor Service Provider tries to activates a debtor 2 times, failing the second attempt","","Wed Feb 12 07:07:12 GMT 2025","passed","Wed Feb 12 07:07:14 GMT 2025","","","",""
"","3078","An authenticated Service Provider cannot send an RTP to an activated debtor","","Wed Feb 12 07:07:18 GMT 2025","passed","Wed Feb 12 07:07:21 GMT 2025","","","",""
"","2317","A debtor Service Provider activates a debtor","","Wed Feb 12 07:07:09 GMT 2025","passed","Wed Feb 12 07:07:12 GMT 2025","","","",""
"","3246","An authenticated creditor Service Provider can send an RTP to an activated debtor","","Wed Feb 12 07:07:14 GMT 2025","passed","Wed Feb 12 07:07:18 GMT 2025","","","",""
"","455","A Service Provider tries to activates a debtor without having the correct credentials","","Wed Feb 12 07:07:14 GMT 2025","passed","Wed Feb 12 07:07:14 GMT 2025","","","",""
