"DESCRIPTION","DURATION IN MS","NAME","PARENT SUITE","START TIME","STATUS","STOP TIME","SUB SUITE","SUITE","TEST CLASS","TEST METHOD"
"","346","A Service Provider tries to activates a debtor without having the correct credentials","","Fri Feb 28 07:07:52 GMT 2025","passed","Fri Feb 28 07:07:52 GMT 2025","","","",""
"","3622","An authenticated creditor Service Provider can send an RTP to an activated debtor","","Fri Feb 28 07:07:52 GMT 2025","passed","Fri Feb 28 07:07:56 GMT 2025","","","",""
"","2450","A debtor Service Provider activates a debtor","","Fri Feb 28 07:07:47 GMT 2025","passed","Fri Feb 28 07:07:50 GMT 2025","","","",""
"","2424","A debtor Service Provider cannot send an RTP","","Fri Feb 28 07:08:02 GMT 2025","passed","Fri Feb 28 07:08:05 GMT 2025","","","",""
"","1","Successful login","","Fri Feb 28 07:08:05 GMT 2025","passed","Fri Feb 28 07:08:05 GMT 2025","","","",""
"","2642","An authenticated Service Provider cannot send an RTP to an unactivated debtor","","Fri Feb 28 07:08:00 GMT 2025","passed","Fri Feb 28 07:08:02 GMT 2025","","","",""
"","2407","A debtor Service Provider tries to activates a debtor 2 times, failing the second attempt","","Fri Feb 28 07:07:50 GMT 2025","passed","Fri Feb 28 07:07:52 GMT 2025","","","",""
"","3500","An authenticated Service Provider cannot send an RTP to an activated debtor","","Fri Feb 28 07:07:56 GMT 2025","passed","Fri Feb 28 07:08:00 GMT 2025","","","",""
