"DESCRIPTION","DURATION IN MS","NAME","PARENT SUITE","START TIME","STATUS","STOP TIME","SUB SUITE","SUITE","TEST CLASS","TEST METHOD"
"","1253","An authenticated Service Provider cannot send an RTP to an unactivated debtor","","Tue Apr 01 16:06:08 GMT 2025","passed","Tue Apr 01 16:06:09 GMT 2025","","","",""
"","1713","A debtor Service Provider cannot send an RTP","","Tue Apr 01 16:06:09 GMT 2025","passed","Tue Apr 01 16:06:11 GMT 2025","","","",""
"","2071","An authenticated Service Provider cannot send an RTP to an activated debtor","","Tue Apr 01 16:06:06 GMT 2025","passed","Tue Apr 01 16:06:08 GMT 2025","","","",""
"","1846","A debtor Service Provider tries to activates a debtor 2 times, failing the second attempt","","Tue Apr 01 16:06:01 GMT 2025","passed","Tue Apr 01 16:06:03 GMT 2025","","","",""
"","1","Successful login","","Tue Apr 01 16:06:11 GMT 2025","passed","Tue Apr 01 16:06:11 GMT 2025","","","",""
"","405","A Service Provider tries to activates a debtor without having the correct credentials","","Tue Apr 01 16:06:03 GMT 2025","passed","Tue Apr 01 16:06:04 GMT 2025","","","",""
"","2173","An authenticated creditor Service Provider can send an RTP to an activated debtor","","Tue Apr 01 16:06:04 GMT 2025","passed","Tue Apr 01 16:06:06 GMT 2025","","","",""
"","2070","A debtor Service Provider activates a debtor","","Tue Apr 01 16:05:59 GMT 2025","passed","Tue Apr 01 16:06:01 GMT 2025","","","",""
